id,date,title,content,tags,mood,weather
352,2023-07-30T19:00:00Z,"A quiet evening of reflection","Reflecting on the month of July. It's been a good one.","reflection",neutral,cloudy
353,2023-07-29T11:00:00Z,"A day of volunteering","Spent the day volunteering. It feels good to give back.","personal",happy,sunny
354,2023-07-28T18:00:00Z,"A fun night with friends","Had a fun night out with friends. Lots of laughs.","friends,social",happy,cloudy
355,2023-07-27T14:00:00Z,"A productive day of coding","I was in the zone today. Wrote a lot of good code.","work,goals",excited,cloudy
356,2023-07-26T21:00:00Z,"A quiet night of reading","Curled up with a good book. It's my favorite way to end the day.","reading,relax",neutral,cloudy
357,2023-07-25T10:00:00Z,"A beautiful morning","It's a beautiful morning. The sun is shining and the birds are singing.","nature",happy,sunny
358,2023-07-24T17:00:00Z,"A long and tiring day","It was a long and tiring day. I'm ready for bed.","work",tired,rainy
359,2023-07-23T19:00:00Z,"A delicious BBQ","Had a delicious BBQ with family. Summer nights are the best.","family,food",happy,sunny
360,2023-07-22T13:00:00Z,"A day of exploring","Spent the day exploring a new part of town. There's always something new to discover.","travel,personal",excited,sunny
361,2023-07-21T22:00:00Z,"A late-night conversation","Had a deep and meaningful conversation with a friend late into the night.","friends",happy,cloudy
362,2023-07-20T11:00:00Z,"A productive brainstorming session","Had a really productive brainstorming session. I'm excited about the new ideas.","work",excited,cloudy
363,2023-07-19T16:00:00Z,"A moment of frustration","Felt a moment of intense frustration today. I had to step away and take a break.","challenge",sad,stormy
364,2023-07-18T19:00:00Z,"A quiet evening of music","Listening to music and just relaxing. It's very therapeutic.","relax",neutral,cloudy
365,2023-07-17T09:00:00Z,"A fresh start","I'm starting a new routine today. I'm hoping it will help me be more productive.","goals",excited,sunny
366,2023-07-16T14:00:00Z,"A lazy Sunday","A very lazy Sunday. I didn't do anything productive and it was wonderful.","relax",neutral,cloudy
367,2023-07-15T18:00:00Z,"A fun day at the amusement park","Spent the day at an amusement park. I feel like a kid again.","friends,social",excited,sunny
368,2023-07-14T21:00:00Z,"A quiet Friday night","Just a quiet Friday night in. Sometimes that's all you need.","relax",neutral,cloudy
369,2023-07-13T12:00:00Z,"A delicious lunch","Had a delicious lunch at a new restaurant. I'll definitely be back.","food",happy,sunny
370,2023-07-12T17:00:00Z,"A difficult task","Completed a very difficult task today. I'm proud of myself for not giving up.","work,challenge",excited,cloudy
371,2023-07-11T20:00:00Z,"A moment of gratitude","Took a moment to be grateful for the good things in my life. It's a good habit to cultivate.","reflection",happy,cloudy
372,2023-07-10T10:00:00Z,"A productive start to the week","I'm starting the week off strong. I'm feeling focused and motivated.","work,goals",excited,sunny
373,2023-07-09T19:00:00Z,"A family movie night","Had a movie night with my family. It was a lot of fun.","family",happy,cloudy
374,2023-07-08T13:00:00Z,"A day of gardening","Spent the day in the garden. It's so rewarding to see things grow.","personal,relax",happy,sunny
375,2023-07-07T22:00:00Z,"A late night of inspiration","I was feeling so inspired tonight that I stayed up late writing.","personal",excited,cloudy
376,2023-07-06T11:00:00Z,"A challenging new skill","I'm learning a new skill and it's really challenging. But I'm determined to master it.","goals",neutral,cloudy
377,2023-07-05T16:00:00Z,"A frustrating error","I spent hours trying to fix an error in my code. It was so frustrating.","work,challenge",tired,stormy
378,2023-07-04T12:00:00Z,"A fun 4th of July","Had a fun 4th of July with friends and fireworks.","friends,social",happy,sunny
379,2023-07-03T18:00:00Z,"A quiet evening before the holiday","A quiet evening at home. Getting ready for the holiday tomorrow.","relax",neutral,cloudy
380,2023-07-02T14:00:00Z,"A day of relaxation","I took a day to just relax and do nothing. It was much needed.","relax",neutral,cloudy
381,2023-07-01T20:00:00Z,"A new month, a new mindset","I'm starting this month with a positive mindset. I'm ready for new challenges.","goals",excited,cloudy
382,2023-06-30T17:00:00Z,"A crazy end to the month","The end of the month is always crazy at work. I'm so glad it's over.","work",tired,rainy
383,2023-06-29T20:00:00Z,"A quiet night of reflection","Spent the evening reflecting on the past month. It's been a journey.","reflection",neutral,cloudy
384,2023-06-28T11:00:00Z,"A productive day of cleaning","I deep cleaned my apartment today. It feels so good to have a clean space.","personal",neutral,cloudy
385,2023-06-27T16:00:00Z,"A difficult conversation","I had a difficult conversation that I've been avoiding. I'm glad I finally did it.","personal,challenge",tired,cloudy
386,2023-06-26T19:00:00Z,"A delicious dinner out","I tried a new restaurant for dinner and it was amazing.","food",happy,cloudy
387,2023-06-25T13:00:00Z,"A lazy Sunday reading","Spent a lazy Sunday afternoon reading in the park. It was perfect.","reading,relax",neutral,sunny
388,2023-06-24T18:00:00Z,"A fun wedding celebration","Attended a friend's wedding. It was a beautiful celebration of love.","friends,social",happy,cloudy
389,2023-06-23T22:00:00Z,"A late-night creative burst","I had a sudden burst of creativity late at night and wrote for hours.","personal",excited,cloudy
390,2023-06-22T10:00:00Z,"A frustrating meeting","I sat through a long, unproductive meeting. It felt like a waste of time.","work",tired,rainy
391,2023-06-21T15:00:00Z,"A moment of clarity","I had a moment of clarity about a problem that has been bothering me. It feels like a weight has been lifted.","reflection",excited,cloudy
392,2023-06-20T18:00:00Z,"A quiet evening at home","Sometimes a quiet evening at home is the best medicine.","relax",neutral,cloudy
393,2023-06-19T09:00:00Z,"A productive start to the week","I'm starting the week off with a lot of energy and motivation.","work,goals",excited,sunny
394,2023-06-18T14:00:00Z,"A Father's Day celebration","Celebrated Father's Day with my dad. It was a special day.","family",happy,sunny
395,2023-06-17T19:00:00Z,"A fun night of karaoke","I went to a karaoke night with friends. It was hilarious and so much fun.","friends,social",happy,cloudy
396,2023-06-16T22:00:00Z,"A late night of studying","I have a big exam coming up, so I stayed up late studying. I'm tired but I feel prepared.","goals",tired,cloudy
397,2023-06-15T12:00:00Z,"A delicious lunch break","I took a proper lunch break today and had a delicious meal. It made a huge difference in my afternoon.","food,work",happy,sunny
398,2023-06-14T17:00:00Z,"A challenging coding problem","I finally solved a coding problem that I've been stuck on for days. It feels amazing.","work,challenge",excited,cloudy
399,2023-06-13T20:00:00Z,"A moment of peace","I found a quiet spot in the park and just sat for a while. It was a moment of pure peace.","relax",neutral,cloudy
400,2023-06-12T10:00:00Z,"A motivated Monday","I'm feeling very motivated this Monday. I'm ready to have a productive week.","goals",excited,sunny
401,2023-06-11T19:00:00Z,"A family game night","We had a family game night. It was so much fun and full of laughter.","family",happy,cloudy
402,2023-06-10T13:00:00Z,"A day of hiking and picnicking","I went for a hike and had a picnic. It was a perfect day.","nature,food",happy,sunny
403,2023-06-09T22:00:00Z,"A late night of inspiration","I was hit with a wave of inspiration late at night and stayed up writing.","personal",excited,cloudy
404,2023-06-08T11:00:00Z,"A challenging new recipe","I tried a challenging new recipe. It didn't turn out perfect, but I learned a lot.","food,challenge",neutral,cloudy
405,2023-06-07T16:00:00Z,"A frustrating afternoon","I had a very frustrating afternoon. Nothing seemed to go my way.","personal",sad,stormy
406,2023-06-06T19:00:00Z,"A quiet evening with a podcast","I listened to a great podcast this evening. It was very thought-provoking.","relax",neutral,cloudy
407,2023-06-05T09:00:00Z,"A fresh start to the week","I'm feeling refreshed and ready for a new week.","goals",excited,sunny
408,2023-06-04T14:00:00Z,"A lazy Sunday afternoon nap","I took a long nap this afternoon. It was glorious.","relax",neutral,cloudy
4running","I went for a long run this morning. It was tough but I feel amazing now.","health",happy,sunny
410,2023-06-02T22:00:00Z,"A late night of movie watching","I stayed up late watching a classic movie. It was a great way to end the week.","relax",neutral,cloudy
411,2023-06-01T12:00:00Z,"A new month, a new challenge","I'm starting a new challenge for the month of June. I'm excited to see how it goes.","goals",excited,sunny
412,2023-05-31T17:00:00Z,"A crazy end to May","The end of the month was so hectic. I'm glad it's over.","work",tired,rainy
413,2023-05-30T20:00:00Z,"A quiet evening of journaling","I spent the evening journaling. It's a great way to process my thoughts.","reflection",neutral,cloudy
414,2023-05-29T11:00:00Z,"A productive Memorial Day","I used the holiday to be productive and get things done around the house.","personal",neutral,cloudy
415,2023-05-28T16:00:00Z,"A relaxing Memorial Day weekend","I've had a very relaxing long weekend. I feel recharged.","relax",neutral,cloudy
416,2023-05-27T19:00:00Z,"A fun BBQ with neighbors","We had a fun BBQ with our neighbors. It was great to get to know them better.","social",happy,sunny
417,2023-05-26T22:00:00Z,"A late night of planning","I stayed up late planning a trip. I'm so excited to go.","travel,goals",excited,cloudy
418,2023-05-25T13:00:00Z,"A productive lunch break","I used my lunch break to go for a walk. It was a nice change of pace.","health,work",neutral,sunny
419,2023-05-24T18:00:00Z,"A difficult day","I had a difficult day today. I'm looking forward to a fresh start tomorrow.","personal",sad,rainy
420,2023-05-23T20:00:00Z,"A delicious home-cooked Italian meal","I made a delicious Italian meal from scratch. It was a lot of work but so worth it.","food",happy,cloudy
421,2023-05-22T10:00:00Z,"A motivated Monday morning","I'm feeling very motivated this Monday morning. I'm ready to crush my goals.","goals",excited,sunny
422,2023-05-21T15:00:00Z,"A lazy Sunday in the sun","I spent the afternoon reading in the sun. It was perfect.","reading,relax",happy,sunny
423,2023-05-20T19:00:00Z,"A fun night of dancing","I went out dancing with friends. It was a great way to let loose.","friends,social",excited,cloudy
424,2023-05-19T22:00:00Z,"A late night of good conversation","I had a long and meaningful conversation with my partner tonight.","personal",happy,cloudy
4seeing a play","I saw a play tonight. It was a fantastic performance.","social",happy,cloudy
426,2023-05-17T17:00:00Z,"A frustrating commute home","My commute home was a nightmare. I'm so tired.","personal",tired,stormy
427,2023-05-16T20:00:00Z,"A quiet evening of meditation","I did a guided meditation this evening. It helped me feel so calm and centered.","health,relax",neutral,cloudy
428,2023-05-15T11:00:00Z,"A productive start to the week","I had a very productive start to the week. I'm feeling on top of my game.","work,goals",excited,sunny
429,2023-05-14T16:00:00Z,"A lovely Mother's Day","I had a lovely Mother's Day with my mom. It was a special day.","family",happy,sunny
430,2023-05-13T19:00:00Z,"A fun concert in the park","I went to a free concert in the park. It was a perfect summer evening.","friends,social",happy,sunny
431,2023-05-12T22:00:00Z,"A late night of creative work","I was feeling creative so I stayed up late painting.","personal",excited,cloudy
432,2023-05-11T13:00:00Z,"A productive power lunch","I had a very productive power lunch. I feel like I accomplished a lot.","work",excited,sunny
433,2023-05-10T18:00:00Z,"A difficult day at the office","I had a difficult day at the office. I'm glad to be home.","work",tired,rainy
434,2023-05-09T20:00:00Z,"A peaceful evening walk","I went for a peaceful evening walk. It was a great way to clear my head.","health,relax",neutral,cloudy
435,2023-05-08T10:00:00Z,"A motivated Monday","I'm feeling very motivated this Monday. I'm ready to take on the week.","goals",excited,sunny
436,2023-05-07T15:00:00Z,"A lazy Sunday watching movies","I spent the day watching movies. It was a perfect lazy Sunday.","relax",neutral,cloudy
4iking","I went for a long hike this morning. The weather was perfect.","nature,health",happy,sunny
438,2023-05-05T22:00:00Z,"A late night of celebration","I celebrated a friend's birthday tonight. It was a lot of fun.","friends,social",happy,cloudy
439,2023-05-04T12:00:00Z,"A delicious Star Wars themed lunch","I made a Star Wars themed lunch. May the 4th be with you!","food,personal",happy,sunny
440,2023-05-03T17:00:00Z,"A challenging workout","I did a really challenging workout today. I'm going to be sore tomorrow.","health",tired,cloudy
441,2023-05-02T20:00:00Z,"A quiet evening of planning","I spent the evening planning my goals for the month.","goals",neutral,cloudy
442,2023-05-01T10:00:00Z,"A new month, a new start","It's the first day of May. I'm feeling optimistic about the month ahead.","goals",excited,sunny
443,2023-04-30T16:00:00Z,"A frantic end to April","The end of the month was so busy. I'm looking forward to a fresh start.","work",tired,rainy
444,2023-04-29T19:00:00Z,"A fun night of bowling","I went bowling with friends. It was a lot of fun.","friends,social",happy,cloudy
445,2023-04-28T22:00:00Z,"A late night of reading","I got so engrossed in my book that I stayed up way too late reading.","reading,relax",neutral,cloudy
446,2023-04-27T13:00:00Z,"A productive lunch meeting","I had a very productive lunch meeting. It's always good to connect with colleagues.","work",neutral,cloudy
447,2023-04-26T18:00:00Z,"A difficult day of debugging","I spent all day debugging a difficult issue. I'm so glad it's finally fixed.","work,challenge",tired,stormy
448,2023-04-25T20:00:00Z,"A delicious homemade dinner","I made a delicious homemade dinner. It's so much better than takeout.","food",happy,cloudy
449,2023-04-24T10:00:00Z,"A motivated Monday","I'm feeling very motivated this Monday. I'm ready to be productive.","goals",excited,sunny
450,2023-04-23T15:00:00Z,"A lazy Sunday of napping","I took a long nap this afternoon. It was much needed.","relax",neutral,cloudy
451,2023-04-22T11:00:00Z,"A beautiful day for a walk","It's a beautiful day. I went for a long walk and enjoyed the sunshine.","health",happy,sunny
452,2023-04-21T19:00:00Z,"A fun night out with my partner","I had a fun night out with my partner. We went to a new restaurant and then saw a movie.","personal",happy,cloudy
453,2023-04-20T22:00:00Z,"A late night of creative inspiration","I was feeling very creative tonight and stayed up late painting.","personal",excited,cloudy
454,2023-04-19T14:00:00Z,"A productive afternoon of deep work","I had a very productive afternoon of deep work. I feel like I accomplished a lot.","work",excited,cloudy
455,2023-04-18T18:00:00Z,"A difficult conversation with a loved one","I had a difficult conversation with a loved one. It's never easy.","family,challenge",sad,rainy
456,2023-04-17T20:00:00Z,"A quiet evening of reflection","I spent the evening reflecting on my goals. It was a good exercise.","reflection",neutral,cloudy
457,2023-04-16T10:00:00Z,"A fresh start to a new week","I'm starting the week with a positive attitude.","goals",excited,sunny
458,2023-04-15T15:00:00Z,"A lazy Saturday","I had a very lazy Saturday. It was nice to do nothing for a change.","relax",neutral,cloudy
459,2023-04-14T19:00:00Z,"A fun night out with old friends","I met up with some old friends tonight. It was so good to see them.","friends,social",happy,cloudy
460,2023-04-13T22:00:00Z,"A late night of reading a thriller","I'm reading a thriller that I can't put down. I'm going to be tired tomorrow.","reading,relax",neutral,cloudy
461,2023-04-12T13:00:00Z,"A productive lunch break","I used my lunch break to go for a run. I feel so much better now.","health,work",neutral,sunny
462,2023-04-11T18:00:00Z,"A frustrating day of meetings","I had back-to-back meetings all day. I'm so drained.","work",tired,rainy
463,2023-04-10T20:00:00Z,"A delicious homemade pasta dinner","I made homemade pasta for dinner. It was so fresh and delicious.","food",happy,cloudy
464,2023-04-09T10:00:00Z,"A beautiful Easter Sunday","I had a beautiful Easter Sunday with my family.","family",happy,sunny
465,2023-04-08T15:00:00Z,"A day of Easter preparations","I spent the day preparing for Easter. It was a lot of work but it will be worth it.","family,food",neutral,cloudy
4LEGOs","I spent the afternoon building with LEGOs. It was very therapeutic.","personal,relax",neutral,cloudy
467,2023-04-06T19:00:00Z,"A quiet evening with a documentary","I watched a fascinating documentary tonight. I learned so much.","relax",neutral,cloudy
468,2023-04-05T10:00:00Z,"A productive Wednesday","I had a very productive Wednesday. I'm feeling ahead of schedule.","work",excited,sunny
469,2023-04-04T18:00:00Z,"A difficult decision at work","I had to make a difficult decision at work. It's weighing on me.","work,challenge",neutral,rainy
470,2023-04-03T20:00:00Z,"A fun night of cooking with my partner","My partner and I cooked dinner together tonight. It was a lot of fun.","personal,food",happy,cloudy
471,2023-04-02T11:00:00Z,"A lazy Sunday morning","I woke up late and had a very lazy Sunday morning. It was perfect.","relax",neutral,cloudy
472,2023-04-01T15:00:00Z,"A fun April Fool's Day","I played a few harmless pranks for April Fool's Day. It was all in good fun.","friends,social",happy,sunny
473,2023-03-31T18:00:00Z,"A crazy end to March","The end of the month was so hectic. I'm glad to see it go.","work",tired,rainy
474,2023-03-30T20:00:00Z,"A quiet evening of reflection","I spent the evening reflecting on the past month. It was a good one.","reflection",neutral,cloudy
4inking","I went for a long hike and then had a picnic. It was a perfect day.","nature,food",happy,sunny
476,2023-03-28T22:00:00Z,"A late night of creative writing","I was feeling inspired and stayed up late writing.","personal",excited,cloudy
477,2023-03-27T13:00:00Z,"A productive power hour","I had a super productive hour. It's amazing what you can accomplish when you focus.","work",excited,cloudy
478,2023-03-26T18:00:00Z,"A difficult conversation","I had a difficult conversation that I've been putting off. I'm glad it's over.","personal,challenge",tired,rainy
479,2023-03-25T20:00:00Z,"A quiet evening with a good book","I curled up with a good book and a cup of tea. It was a perfect evening.","reading,relax",neutral,cloudy
480,2023-03-24T10:00:00Z,"A motivated Friday","I'm feeling very motivated this Friday. I'm going to finish the week strong.","work,goals",excited,sunny
481,2023-03-23T15:00:00Z,"A lazy Thursday afternoon","I had a very lazy Thursday afternoon. It was a nice break.","relax",neutral,cloudy
4arathon","I had a movie marathon with friends. It was a lot of fun.","friends,social",happy,cloudy
483,2023-03-21T22:00:00Z,"A late night of deep thoughts","I was up late just thinking about life. It was a night of deep thoughts.","reflection",neutral,cloudy
484,2023-03-20T13:00:00Z,"A productive lunch break","I used my lunch break to get some errands done. It was very productive.","personal",neutral,sunny
485,2023-03-19T18:00:00Z,"A difficult workout","I did a really difficult workout today. I'm exhausted but I feel accomplished.","health",tired,cloudy
486,2023-03-18T20:00:00Z,"A fun night out","I went out with friends tonight. It was a much-needed night of fun.","friends,social",happy,cloudy
487,2That's a great idea! I can definitely help with that. "Upgrading the project" can cover a lot of ground. To make sure I focus on what's most important to you, could you tell me what kind of improvements you have in mind?

For example, are you thinking about:

1.  **Adding new features**, like the ability to attach images to your entries or maybe some analytics?
2.  **Improving the user interface** with new layouts or better styling?
3.  **Upgrading the code quality** and performance behind the scenes?
4.  Or something else entirely?

Once I know what you're looking for, I can put together a plan to make it happen
","I'm starting the week with a lot of motivation. I'm ready to be productive.","work,goals",excited,sunny
488,2023-03-16T15:00:00Z,"A lazy St. Patrick's Day","I had a very lazy St. Patrick's Day. It was nice to just relax.","relax",neutral,cloudy
489,2023-03-15T19:00:00Z,"A fun St. Patrick's Day celebration","I celebrated St. Patrick's Day with friends. It was a lot of fun.","friends,social",happy,cloudy
490,2023-03-14T22:00:00Z,"A late night of pie baking","I stayed up late baking a pie for Pi Day. It was a delicious success.","food,personal",happy,cloudy
491,2023-03-13T13:00:00Z,"A productive lunch break","I used my lunch break to go for a walk. It was a nice way to clear my head.","health,work",neutral,sunny
492,2023-03-12T18:00:00Z,"A difficult day of travel","I had a difficult day of travel. I'm so glad to be home.","travel,challenge",tired,stormy
493,2023-03-11T20:00:00Z,"A quiet evening of reading a biography","I'm reading a fascinating biography. It's inspiring me.","reading,relax",neutral,cloudy
494,2023-03-10T10:00:00Z,"A motivated Friday morning","I'm feeling very motivated this Friday morning. I'm going to have a productive day.","work,goals",excited,sunny
495,2023-03-09T15:00:00Z,"A lazy Thursday afternoon","I had a very lazy Thursday afternoon. It was a nice break in the middle of the week.","relax",neutral,cloudy
496,2023-03-08T19:00:00Z,"A fun dinner with family","I had a fun dinner with my family. It's always good to catch up.","family",happy,cloudy
497,2023-03-07T22:00:00Z,"A late night of journaling","I was feeling very reflective and stayed up late journaling.","reflection",neutral,cloudy
498,2023-03-06T13:00:00Z,"A productive lunch meeting","I had a very productive lunch meeting. We made a lot of progress.","work",excited,cloudy
499,2023-03-05T18:00:00Z,"A difficult workout","I did a really difficult workout today. I'm going to be sore tomorrow, but it was worth it.","health",tired,cloudy
500,2023-03-04T20:00:00Z,"A quiet evening of music","I spent the evening listening to music. It was very relaxing.","relax",neutral,cloudy
