id,date,title,content,tags,mood,weather
176,2024-01-22T10:00:00Z,"A sunny morning","Woke up to a beautiful sunny morning. It instantly put me in a good mood.","personal",happy,sunny
177,2024-01-21T15:00:00Z,"A day of errands","Spent the day running errands. It was productive but I'm tired now.","personal",tired,cloudy
178,2024-01-20T19:00:00Z,"A fun reunion","Met up with some old friends from high school. It was so fun to reminisce.","friends,social",happy,cloudy
179,2024-01-19T08:00:00Z,"A morning of writing","Spent the morning writing. The words just flowed today.","personal",excited,sunny
180,2024-01-18T21:00:00Z,"A quiet evening with music","Listening to some calming music and unwinding. It's the perfect end to a long day.","relax",neutral,cloudy
181,2024-01-17T12:00:00Z,"A delicious lunch date","Had a delicious lunch date with my partner. It's nice to have these midday escapes.","personal,food",happy,sunny
182,2024-01-16T17:00:00Z,"A challenging problem","Solved a challenging problem at work. It feels so satisfying.","work,challenge",excited,cloudy
183,2024-01-15T20:00:00Z,"A wave of nostalgia","An old song came on the radio and it brought back a flood of memories.","reflection",neutral,cloudy
184,2024-01-14T10:00:00Z,"A lazy Sunday morning","Woke up without an alarm and just lounged in bed. It was heavenly.","relax",neutral,cloudy
185,2024-01-13T16:00:00Z,"A day of adventure","Went on a spontaneous road trip. Sometimes the best plans are no plans at all.","travel,personal",excited,sunny
186,2024-01-12T19:00:00Z,"A difficult good-bye","Had to say goodbye to a loved one today. My heart is heavy.","family,personal",sad,rainy
187,2024-01-11T09:00:00Z,"A fresh start","I'm starting a new project today. I'm full of ideas and excitement.","goals,work",excited,sunny
188,2024-01-10T22:00:00Z,"A tired body, a full heart","I'm physically exhausted, but my heart is full. It was a good day.","reflection",tired,cloudy
189,2024-01-09T14:00:00Z,"A productive meeting","Had a really productive meeting. We made a lot of progress.","work",excited,cloudy
190,2024-01-08T18:00:00Z,"A moment of gratitude","Took a moment to just be grateful for everything I have. It's a good practice.","reflection",happy,cloudy
191,2024-01-07T11:00:00Z,"A beautiful hike","Went for a beautiful hike in the mountains. The scenery was breathtaking.","nature,travel",happy,sunny
192,2024-01-06T20:00:00Z,"A quiet night of reading","Spent the whole evening reading. I lost track of time.","reading,relax",neutral,cloudy
193,2024-01-05T10:00:00Z,"A new year, a new me","It's the first week of the new year and I'm feeling motivated to make some positive changes.","goals",excited,sunny
194,2024-01-04T16:00:00Z,"A frustrating setback","Had a frustrating setback with my new year's resolution. But I'm not giving up.","goals,challenge",sad,cloudy
195,2024-01-03T19:00:00Z,"A cozy night in","It's cold outside, so I'm having a cozy night in with a movie and a blanket.","relax",neutral,cloudy
196,2024-01-02T13:00:00Z,"A productive afternoon","Had a very productive afternoon. I feel like I'm starting the year off right.","work,goals",excited,sunny
197,2024-01-01T00:00:00Z,"Happy New Year!","Happy New Year! I'm excited to see what this year will bring.","friends,social",excited,cloudy
198,2023-12-31T23:00:00Z,"Reflecting on the year","Reflecting on the past year. It's been a rollercoaster of a year.","reflection",neutral,cloudy
199,2023-12-30T18:00:00Z,"A pre-new year's eve party","Had a fun party with friends to celebrate the end of the year.","friends,social",happy,cloudy
200,2023-12-29T15:00:00Z,"A day of last-minute shopping","Did some last-minute shopping for New Year's Eve. It was chaotic but I got everything I needed.","personal",tired,cloudy
201,2023-12-28T20:00:00Z,"A quiet evening","Just a quiet evening at home. I'm enjoying the calm before the storm of New Year's celebrations.","relax",neutral,cloudy
202,2023-12-27T11:00:00Z,"A winter wonderland","The snow is so beautiful. It looks like a winter wonderland outside.","nature",happy,snowy
203,2023-12-26T16:00:00Z,"A post-Christmas slump","Feeling a bit of a post-Christmas slump. The excitement is over.","personal",sad,cloudy
204,2023-12-25T12:00:00Z,"Merry Christmas!","Merry Christmas! Had a wonderful day with my family.","family",happy,snowy
205,2023-12-24T22:00:00Z,"Christmas Eve","It's Christmas Eve! The anticipation is palpable. I can't wait for tomorrow.","family",excited,snowy
206,2023-12-23T18:00:00Z,"A festive gathering","Had a festive gathering with friends. It was so much fun.","friends,social",happy,cloudy
207,2023-12-22T14:00:00Z,"A frustrating travel day","My travel plans got messed up. It was a long and frustrating day.","travel,challenge",tired,stormy
208,2023-12-21T20:00:00Z,"A quiet night before the holidays","Enjoying a quiet night before the holiday madness begins.","relax",neutral,cloudy
209,2023-12-20T10:00:00Z,"A productive day of gift wrapping","Spent the day wrapping gifts. I'm officially ready for Christmas.","personal",neutral,cloudy
210,2023-12-19T17:00:00Z,"A difficult conversation with family","Had a difficult conversation with a family member. The holidays can be tough.","family,challenge",sad,rainy
211,2023-12-18T19:00:00Z,"A cozy evening with a Christmas movie","Watched a classic Christmas movie. It got me in the holiday spirit.","personal",happy,cloudy
212,2023-12-17T11:00:00Z,"A day of baking","Spent the day baking Christmas cookies. The whole house smells amazing.","food,personal",happy,cloudy
213,2023-12-16T16:00:00Z,"A magical snowfall","It started snowing! It's so magical and beautiful.","nature",happy,snowy
214,2023-12-15T21:00:00Z,"A quiet Friday night","Just a quiet Friday night in. I'm saving my energy for the weekend.","relax",neutral,cloudy
215,2023-12-14T09:00:00Z,"A productive work day","Had a super productive day at work. I'm feeling ahead of the game.","work",excited,sunny
216,2023-12-13T18:00:00Z,"A frustrating technical issue","Spent hours dealing with a technical issue. It was so frustrating.","work,challenge",tired,stormy
217,2023-12-12T20:00:00Z,"A fun dinner with colleagues","Had a fun dinner with my colleagues to celebrate the end of the year.","work,social",happy,cloudy
218,2023-12-11T13:00:00Z,"A moment of peace","Found a moment of peace in the midst of a chaotic day. It was much needed.","relax",neutral,cloudy
219,2023-12-10T10:00:00Z,"A lazy Sunday","Woke up late and had a lazy Sunday. It was the perfect way to recharge.","relax",neutral,cloudy
220,2023-12-09T15:00:00Z,"A day of Christmas shopping","Braved the crowds and did some Christmas shopping. It was crazy but I found some great gifts.","personal",tired,cloudy
221,2023-12-08T19:00:00Z,"A cozy night by the fire","It's cold outside, so I'm spending the night by the fire. It's so cozy.","relax",neutral,cloudy
222,2023-12-07T08:00:00Z,"An early morning workout","Woke up early for a workout. It was tough but I feel great now.","health",happy,sunny
223,2023-12-06T22:00:00Z,"A late night of planning","Stayed up late planning for the holidays. There's so much to do!","goals",tired,cloudy
224,2c023-12-05T14:00:00Z,"A productive afternoon of writing","Had a very productive afternoon of writing. The words were just flowing.","personal",excited,cloudy
225,2023-12-04T18:00:00Z,"A difficult phone call","Had to make a difficult phone call today. I'm glad it's over.","personal,challenge",tired,rainy
226,2023-12-03T11:00:00Z,"A beautiful winter day","It's a beautiful, crisp winter day. The sun is shining and the air is cold.","nature",happy,sunny
227,2023-12-02T16:00:00Z,"A creative spark","Felt a creative spark and started a new painting. I'm excited to see where it goes.","personal",excited,cloudy
228,2023-12-01T20:00:00Z,"A new month, a new perspective","It's the first day of the last month of the year. I'm taking some time to reflect.","reflection",neutral,cloudy
229,2023-11-30T15:00:00Z,"A stressful end to the month","Work was so stressful trying to meet end-of-month deadlines. I'm exhausted.","work",tired,stormy
230,2023-11-29T19:00:00Z,"A quiet evening of gratitude","Spent the evening writing down everything I'm grateful for. It was a good exercise.","reflection",happy,cloudy
231,2023-11-28T11:00:00Z,"A day of decluttering","Spent the day decluttering my apartment. It feels so good to get rid of things I don't need.","personal",neutral,cloudy
232,2023-11-27T17:00:00Z,"A long and tiring commute","My commute was extra long and tiring today. I can't wait to just relax.","personal",tired,rainy
233,2023-11-26T21:00:00Z,"A night of board games","Had a fun night of board games with my family. It's always a good laugh.","family",happy,cloudy
234,2023-11-25T10:00:00Z,"A lazy Saturday after the holiday","Just a lazy Saturday. Recovering from all the Thanksgiving food.","relax",neutral,cloudy
235,2023-11-24T16:00:00Z,"A day of leftovers and movies","Spent the day eating leftovers and watching movies. It was the perfect post-Thanksgiving day.","relax,food",neutral,cloudy
236,2023-11-23T14:00:00Z,"Happy Thanksgiving!","Happy Thanksgiving! Had a wonderful day with my family. I'm so full.","family,food",happy,cloudy
237,2023-11-22T19:00:00Z,"A pre-Thanksgiving buzz","The whole city has a pre-Thanksgiving buzz. I'm excited for tomorrow.","personal",excited,cloudy
238,2023-11-21T10:00:00Z,"A productive day of cooking","Spent the day cooking and prepping for Thanksgiving. It was a lot of work but it will be worth it.","food",neutral,cloudy
239,2023-11-20T17:00:00Z,"A difficult travel day","Traveled to my family's for Thanksgiving. The airport was a zoo.","travel,challenge",tired,stormy
240,2023-11-19T20:00:00Z,"A quiet Sunday night","A quiet Sunday night. Mentally preparing for the holiday week ahead.","relax",neutral,cloudy
241,2023-11-18T11:00:00Z,"A beautiful autumn day","It's a beautiful autumn day. The leaves are so colorful.","nature",happy,sunny
242,2023-11-17T16:00:00Z,"A frustrating problem","Ran into a frustrating problem at work. I feel like I'm banging my head against a wall.","work,challenge",tired,rainy
243,2023-11-16T19:00:00Z,"A fun night out with friends","Went out for dinner and drinks with friends. It was a much-needed night out.","friends,social",happy,cloudy
244,2023-11-15T08:00:00Z,"A morning of focus","Had a very focused and productive morning. I'm feeling good about my progress.","work,goals",excited,sunny
245,2023-11-14T22:00:00Z,"A late night of reading","Stayed up late reading a captivating book. I couldn't put it down.","reading,relax",neutral,cloudy
246,2023-11-13T14:00:00Z,"A productive collaboration","Collaborated with a colleague on a project and we made great progress.","work",excited,cloudy
247,2023-11-12T18:00:00Z,"A moment of self-reflection","Took some time for self-reflection today. It's important to check in with yourself.","reflection",neutral,cloudy
248,2023-11-11T11:00:00Z,"A day of remembrance","Thinking of all those who have served. It's a day of remembrance and gratitude.","reflection",neutral,cloudy
249,2023-11-10T20:00:00Z,"A quiet Friday night in","A quiet Friday night. Sometimes it's nice to just relax and recharge.","relax",neutral,cloudy
250,2023-11-09T10:00:00Z,"A challenging puzzle","Worked on a challenging jigsaw puzzle. It's a great way to exercise my brain.","personal",neutral,cloudy
251,2023-11-08T17:00:00Z,"A difficult meeting","Had a difficult meeting with my team. It's hard to navigate different opinions.","work,challenge",tired,rainy
252,2023-11-07T19:00:00Z,"A delicious home-cooked meal","Made a delicious and healthy meal at home. It's so much better than eating out.","food",happy,cloudy
253,2023-11-06T08:00:00Z,"A fresh start to the week","Feeling refreshed and ready to start the new week.","goals",excited,sunny
254,2023-11-05T21:00:00Z,"A quiet Sunday evening","A quiet Sunday evening. Preparing for the week ahead.","relax",neutral,cloudy
255,2023-11-04T15:00:00Z,"A day of exploring the city","Spent the day exploring a new neighborhood. I love discovering hidden gems in my own city.","travel,personal",excited,sunny
256,2023-11-03T18:00:00Z,"A fun bonfire with friends","Had a bonfire with friends. It was a perfect autumn evening.","friends,social",happy,cloudy
257,2023-11-02T12:00:00Z,"A productive lunch meeting","Had a productive lunch meeting. It's always good to connect with colleagues outside of the office.","work",neutral,cloudy
258,2023-11-01T20:00:00Z,"A new month, new possibilities","It's the first of the month. I'm excited for what's to come.","goals",excited,cloudy
259,2023-10-31T21:00:00Z,"Happy Halloween!","Happy Halloween! Had a fun night dressing up and handing out candy.","social",happy,cloudy
260,2023-10-30T17:00:00Z,"A pre-Halloween sugar rush","Ate way too much candy today. The pre-Halloween sugar rush is real.","food",excited,cloudy
261,2023-10-29T14:00:00Z,"A day of pumpkin carving","Spent the day carving pumpkins. It's a fun and messy tradition.","family,social",happy,cloudy
262,2023-10-28T19:00:00Z,"A spooky movie night","Had a spooky movie night with friends. It was the perfect way to get in the Halloween spirit.","friends,social",happy,cloudy
263,2023-10-27T16:00:00Z,"A frustrating day of costume shopping","Went costume shopping and couldn't find anything I liked. It was so frustrating.","personal",tired,rainy
264,2023-10-26T20:00:00Z,"A quiet night of reading a scary book","Reading a scary book to get in the Halloween mood. I'm loving it.","reading,relax",neutral,cloudy
265,2023-10-25T11:00:00Z,"A beautiful fall day","It's a beautiful fall day. The leaves are at their peak color.","nature",happy,sunny
266,2023-10-24T17:00:00Z,"A difficult conversation with a friend","Had a difficult conversation with a friend. It's hard to be honest sometimes.","friends,challenge",sad,rainy
267,2023-10-23T19:00:00Z,"A cozy evening with a warm drink","Drinking a warm apple cider and feeling cozy. I love this time of year.","relax",neutral,cloudy
268,2023-10-22T13:00:00Z,"A day of apple picking","Went apple picking with my family. It was a perfect fall activity.","family,food",happy,sunny
269,2023-10-21T21:00:00Z,"A quiet Saturday night","Just a quiet Saturday night at home. Sometimes it's nice to have no plans.","relax",neutral,cloudy
270,2023-10-20T10:00:00Z,"A productive Friday morning","Had a very productive Friday morning. I'm ready for the weekend.","work",excited,sunny
271,2023-10-19T18:00:00Z,"A frustrating technical glitch","Dealt with a frustrating technical glitch all afternoon. I'm so glad it's finally fixed.","work,challenge",tired,stormy
272,2023-10-18T20:00:00Z,"A fun team dinner","Had a fun dinner with my team to celebrate a successful project.","work,social",happy,cloudy
273,2023-10-17T12:00:00Z,"A moment of mindfulness","Took a few moments for mindfulness meditation. It helped me reset my day.","health,relax",neutral,cloudy
274,2023-10-16T08:00:00Z,"A motivated Monday","Feeling motivated and ready to tackle the week.","goals",excited,sunny
275,2023-10-15T21:00:00Z,"A quiet Sunday to recharge","A quiet Sunday. I'm recharging my batteries for the week ahead.","relax",neutral,cloudy
276,2023-10-14T15:00:00Z,"A day of exploring a new trail","Explored a new hiking trail today. The views were incredible.","nature,travel",happy,sunny
277,2023-10-13T19:00:00Z,"A cozy bonfire","Had a cozy bonfire in the backyard. There's something so mesmerizing about watching the flames.","relax",neutral,cloudy
278,2023-10-12T13:00:00Z,"A productive power hour","Had a super productive power hour. I'm amazed at how much I got done.","work",excited,cloudy
279,2023-10-11T17:00:00Z,"A difficult feedback session","Had to give some difficult feedback to a colleague. It's never easy.","work,challenge",tired,rainy
280,2023-10-10T20:00:00Z,"A fun night of trivia","Went to a trivia night with friends. We didn't win but we had a lot of fun.","friends,social",happy,cloudy
281,2023-10-09T09:00:00Z,"A clear and focused morning","My mind feels so clear and focused this morning. I'm ready to be productive.","personal",excited,sunny
282,2023-10-08T22:00:00Z,"A late night of creative writing","Stayed up late working on a creative writing piece. The ideas were just flowing.","personal",excited,cloudy
283,2023-10-07T14:00:00Z,"A day of museum hopping","Spent the day visiting different museums. It was a great cultural experience.","personal,travel",happy,cloudy
284,2023-10-06T18:00:00Z,"A frustrating traffic jam","Got stuck in a massive traffic jam on my way home. It was so frustrating.","personal",tired,stormy
285,2023-10-05T20:00:00Z,"A delicious fall meal","Cooked a delicious fall-themed meal. I love cooking with seasonal ingredients.","food",happy,cloudy
286,2023-10-04T11:00:00Z,"A productive brainstorming session","Had a great brainstorming session with my team. We came up with some amazing ideas.","work",excited,cloudy
287,2023-10-03T16:00:00Z,"A moment of self-doubt","Feeling a bit of self-doubt today. It's hard to shake off.","reflection",sad,cloudy
288,2023-10-02T19:00:00Z,"A quiet evening with a good movie","Watched a really good movie tonight. It was a great escape.","relax",neutral,cloudy
289,2023-10-01T09:00:00Z,"A new month, a new mindset","It's a new month. I'm approaching it with a positive mindset.","goals",excited,sunny
290,2023-09-30T21:00:00Z,"Reflecting on September","The month is over. I'm reflecting on my achievements and failures.","reflection",neutral,cloudy
291,2023-09-29T15:00:00Z,"A frantic Friday","Work was absolutely frantic today. I am so ready for the weekend.","work",tired,rainy
292,2023-09-28T18:00:00Z,"A chill evening","Just a very chill evening. No stress, no worries.","relax",neutral,cloudy
293,2023-09-27T12:00:00Z,"Lunch with an old friend","Caught up with an old friend over lunch. It was so good to see them.","friends",happy,sunny
294,2023-09-26T17:00:00Z,"A small victory","Celebrated a small victory at work today. It's the little things.","work",happy,cloudy
295,2023-09-25T20:00:00Z,"A gloomy day","The weather was gloomy and so was my mood.","personal",sad,rainy
296,2023-09-24T14:00:00Z,"A day of football","Spent the day watching football with friends. A perfect Sunday.","friends,social",happy,cloudy
297,2023-09-23T11:00:00Z,"A trip to the farmer's market","Went to the farmer's market this morning. So many fresh fruits and vegetables!","food,personal",happy,sunny
298,2023-09-22T22:00:00Z,"A late-night coding session","I'm on a roll with this coding project. Decided to work late into the night.","work,goals",excited,cloudy
299,2023-09-21T10:00:00Z,"A difficult choice","I have a difficult choice to make. I've been weighing the pros and cons all morning.","challenge",neutral,cloudy
300,2023-09-20T19:00:00Z,"A wonderful surprise","My partner planned a wonderful surprise for me tonight. I feel so loved.","personal",happy,cloudy
301,2023-09-19T16:00:00Z,"A draining meeting","That meeting drained all my energy. Time to recharge.","work",tired,rainy
302,2023-09-18T08:30:00Z,"A great start","This week is off to a great start. Feeling positive and motivated.","goals",excited,sunny
303,2023-09-17T18:00:00Z,"Sunday scaries","The Sunday scaries are hitting hard tonight. Not ready for the weekend to be over.","personal",sad,cloudy
304,2023-09-16T12:00:00Z,"A perfect fall day","Crisp air, colorful leaves. A perfect fall day.","nature",happy,sunny
305,2023-09-15T20:00:00Z,"A much-needed night in","After a long week, a night in is exactly what I needed.","relax",neutral,cloudy
306,2023-09-14T15:00:00Z,"A big presentation","Gave a big presentation today. I was nervous but it went really well.","work,challenge",excited,cloudy
307,2023-09-13T21:00:00Z,"A good cry","Had a good cry tonight. Sometimes you just need to let it all out.","personal",sad,rainy
308,2023-09-12T11:00:00Z,"A new coffee shop","Tried a new coffee shop today. The latte was excellent.","food,personal",happy,sunny
309,2023-09-11T09:00:00Z,"A somber day","A day for reflection and remembrance. Never forget.","reflection",neutral,cloudy
310,2023-09-10T14:00:00Z,"A day of reading and relaxing","I love Sundays. I spent the whole day reading and relaxing.","reading,relax",neutral,cloudy
311,2023-09-09T19:00:00Z,"A fun wedding","Attended a beautiful wedding tonight. So much love and happiness.","friends,social",happy,cloudy
312,2023-09-08T17:00:00Z,"A long week","This has been such a long week. I'm so glad it's finally Friday.","work",tired,cloudy
313,2023-09-07T13:00:00Z,"A productive power nap","Took a power nap and now I feel so much more productive.","personal",neutral,sunny
314,2023-09-06T20:00:00Z,"A delicious discovery","Discovered a new restaurant and the food was incredible.","food",excited,cloudy
315,2023-09-05T10:00:00Z,"Back to work","First day back at work after a long weekend. It's tough to get back into the swing of things.","work",tired,cloudy
316,2023-09-04T12:00:00Z,"Labor Day fun","Enjoyed the Labor Day holiday with a BBQ and friends.","friends,social",happy,sunny
317,2023-09-03T18:00:00Z,"A long weekend","So grateful for this long weekend. It's been very relaxing.","relax",neutral,cloudy
318,2023-09-02T11:00:00Z,"A trip to the beach","Spent the day at the beach. The sound of the waves is so calming.","travel,nature",happy,sunny
319,2023-09-01T20:00:00Z,"September begins","Hello September! I love the feeling of a new month.","goals",excited,cloudy
320,2023-08-31T16:00:00Z,"End of summer","It's the last day of August. The end of summer is always a little sad.","reflection",sad,cloudy
321,2023-08-30T19:00:00Z,"A quiet evening walk","Took a quiet evening walk. The weather is perfect.","relax,health",neutral,cloudy
322,2023-08-29T14:00:00Z,"A frustrating bug","I've been trying to fix this bug for hours. It's so frustrating.","work,challenge",tired,stormy
323,2023-08-28T09:00:00Z,"A Monday morning reset","Starting the week with a positive attitude. It's a reset.","goals",excited,sunny
324,2023-08-27T21:00:00Z,"A movie marathon","Had a movie marathon all day. It was a great way to spend a Sunday.","relax",neutral,cloudy
325,2023-08-26T15:00:00Z,"A fun day at the fair","Went to the state fair today. So much food and fun.","friends,social",happy,sunny
326,2023-08-25T18:00:00Z,"A spontaneous concert","Went to a spontaneous concert in the park. It was amazing.","social",excited,cloudy
327,2023-08-24T12:00:00Z,"A productive lunch break","I actually worked through my lunch break. Not ideal, but I got a lot done.","work",tired,cloudy
328,2023-08-23T20:00:00Z,"A home-cooked masterpiece","I cooked a meal that was so good, I'm calling it a masterpiece.","food",happy,cloudy
329,2023-08-22T10:00:00Z,"A challenging new project","Started a challenging new project at work. I'm excited for the opportunity to learn.","work,goals",excited,cloudy
330,2023-08-21T17:00:00Z,"A case of the Mondays","I've got a classic case of the Mondays. I'm already looking forward to the weekend.","work",tired,cloudy
331,2023-08-20T19:00:00Z,"A quiet Sunday","Just a quiet Sunday. Reading, relaxing, and preparing for the week.","relax,reading",neutral,cloudy
332,2023-08-19T13:00:00Z,"A day of hiking","Spent the day hiking a new trail. It was challenging but the views were worth it.","nature,health",happy,sunny
333,2023-08-18T21:00:00Z,"A fun night out","Went out for dinner and dancing. It was a really fun night.","friends,social",excited,cloudy
3An a-MA-zing discovery","I discovered a new band and I'm obsessed.","music",excited,cloudy
335,2023-08-16T18:00:00Z,"A difficult conversation at work","Had to have a difficult conversation with my manager. It was stressful.","work,challenge",tired,rainy
336,2023-08-15T20:00:00Z,"A peaceful evening","The evening is so peaceful. I'm sitting outside and just listening to the sounds of nature.","relax,nature",neutral,cloudy
337,2023-08-14T11:00:00Z,"A productive morning","I was so productive this morning. I feel like I can take on the world.","work,goals",excited,sunny
338,2023-08-13T16:00:00Z,"A lazy Sunday afternoon","Spent the afternoon napping and reading. It was glorious.","relax,reading",neutral,cloudy
339,2023-08-12T19:00:00Z,"A family BBQ","Had a great time at a family BBQ. So much food and laughter.","family,social",happy,sunny
340,2023-08-11T22:00:00Z,"A late-night movie","Watched a movie late into the night. It was worth the lack of sleep.","relax",neutral,cloudy
341,2023-08-10T10:00:00Z,"A frustrating morning","Nothing is going right this morning. I'm feeling very frustrated.","personal",sad,stormy
342,2023-08-09T15:00:00Z,"A breakthrough moment","Had a breakthrough moment with a project I've been struggling with. It feels amazing.","work,goals",excited,cloudy
343,2023-08-08T18:00:00Z,"A delicious meal out","Tried a new restaurant and the food was absolutely delicious.","food",happy,cloudy
344,2023-08-07T09:00:00Z,"A motivated start to the week","Woke up feeling motivated and ready to have a great week.","goals",excited,sunny
345,2023-08-06T20:00:00Z,"A quiet Sunday evening","A quiet Sunday evening. Perfect for reflecting and planning.","reflection",neutral,cloudy
346,2023-08-05T14:00:00Z,"A day at the lake","Spent the day at the lake. Swimming, sunbathing, and just relaxing.","travel,relax",happy,sunny
347,2023-08-04T19:00:00Z,"A fun concert","Went to a great concert tonight. The music was fantastic.","friends,social",excited,cloudy
348,2023-08-03T13:00:00Z,"A productive power hour","I had a super productive hour. It's amazing what you can accomplish when you focus.","work",excited,cloudy
349,2023-08-02T17:00:00Z,"A difficult decision","I had to make a difficult decision today. I hope it was the right one.","challenge",neutral,rainy
350,2023-08-01T20:00:00Z,"A new month, a new chapter","It's the first day of a new month. I'm ready for a new chapter.","goals",excited,cloudy
351,2023-07-31T16:00:00Z,"A frantic end to the month","Work was insane today. So glad the month is over.","work",tired,stormy
