id,date,title,content,tags,mood,weather
1,2024-07-15T10:00:00Z,"A New Beginning","Today marks the start of a new chapter. I'm excited to see what the future holds. I spent the morning planning out my goals for the next few months.","goals,reflection",excited,sunny
2,2024-07-14T21:30:00Z,"Quiet Evening","Just a quiet evening at home. Sometimes it's nice to just relax and do nothing. I watched a movie and read a bit of my book.","personal,relax",neutral,cloudy
3,2024-07-13T14:05:00Z,"Work Challenges","Faced a few tough challenges at work today, but managed to get through them. Feeling a bit drained but accomplished.","work,challenge",tired,rainy
4,2024-07-12T08:15:00Z,"Morning Hike","Went for a beautiful morning hike. The air was fresh and the views were incredible. A great way to start the day.","travel,nature,health",happy,sunny
5,2024-07-11T18:45:00Z,"Dinner with Friends","Had a wonderful dinner with old friends. It's always great to catch up and reminisce about the good old days.","friends,social",happy,cloudy
6,2024-07-10T12:00:00Z,"Feeling Uninspired","Struggling to find motivation today. Everything feels a bit gray. Hoping for a better day tomorrow.","personal",sad,rainy
7,2024-07-09T23:00:00Z,"Late Night Thoughts","My mind is racing with ideas and worries. It's hard to switch off sometimes. I should probably write more often.","reflection",neutral,cloudy
8,2024-07-08T16:20:00Z,"Project Milestone","Reached a major milestone on my personal project today! It feels so good to see progress.","goals,work",excited,sunny
9,2024-07-07T11:55:00Z,"Family Get-together","A lovely day spent with family. Lots of laughter and good food. Feeling grateful for these moments.","family",happy,sunny
10,2024-07-06T19:00:0Z,"A frustrating day","Nothing seemed to go right today. Spilled coffee on my shirt and missed my bus. Just one of those days.","personal",sad,stormy
11,2024-07-05T09:30:00Z,"Planning a Trip","Started planning a vacation for next year. The thought of exploring a new place is so exciting!","travel,goals",excited,cloudy
12,2024-07-04T17:00:00Z,"Holiday BBQ","Enjoyed a nice BBQ for the holiday. Simple pleasures are the best.","friends,social",happy,sunny
13,2024-07-03T22:10:00Z,"Finished a Book","Finished an amazing book tonight. The story will stay with me for a while. It's inspiring me to write my own.","personal,reading",neutral,cloudy
14,2024-07-02T13:00:00Z,"A Productive Afternoon","Had a very productive afternoon. Ticked off so many items from my to-do list. Feeling on top of the world.","work,goals",excited,sunny
15,2024-07-01T20:00:00Z,"Missing Home","Feeling a bit homesick today. It's tough being far away from family.","family,personal",sad,rainy
16,2024-06-30T10:45:00Z,"Trying a New Recipe","Tried a new recipe for lunch and it was a success! It's fun to experiment in the kitchen.","personal,food",happy,cloudy
17,2024-06-29T15:00:00Z,"Rainy Day Musings","The sound of the rain is so calming. Spent the afternoon just watching it from my window and thinking.","reflection",neutral,rainy
18,2024-06-28T18:00:00Z,"Team Success","Our team at work finally solved a problem we've been stuck on for weeks. It was a great collaborative effort.","work,challenge",excited,cloudy
19,2024-06-27T07:30:00Z,"Early Morning Run","Woke up early for a run. It was tough but I feel so energized now.","health",happy,sunny
20,2024-06-26T21:00:00Z,"An Unexpected Call","Got an unexpected call from an old friend. It was a pleasant surprise and made my day.","friends",happy,cloudy
21,2024-06-25T14:20:00Z,"Feeling Overwhelmed","The workload is piling up and I'm feeling overwhelmed. Need to take a step back and prioritize.","work",tired,stormy
22,2024-06-24T19:30:00Z,"Movie Night","A simple movie night at home. Exactly what I needed to unwind after a long day.","relax",neutral,cloudy
23,2024-06-23T11:00:00Z,"Exploring the City","Spent the day exploring a new part of the city. Found a charming little bookstore.","travel,personal",excited,sunny
24,2024-06-22T16:00:00Z,"A tough decision","Had to make a tough decision today. I hope I made the right choice. Only time will tell.","reflection,personal",neutral,cloudy
25,2024-06-21T22:45:00Z,"Stargazing","The sky is so clear tonight. Spent some time just looking at the stars and feeling small in the vast universe.","reflection,nature",neutral,sunny
26,2024-06-20T08:00:00Z,"A Fresh Start","Decided to start a new habit today. I'm committed to sticking with it for at least 30 days.","goals,health",excited,sunny
27,2024-06-19T13:30:00Z,"Lunch with a Mentor","Had a great lunch with my mentor. Always get such valuable advice and perspective.","work,goals",happy,cloudy
28,2024-06-18T18:00:00Z,"A Disappointing Outcome","The project I was working on didn't turn out as expected. Feeling disappointed but trying to learn from it.","work,challenge",sad,rainy
29,2024-06-17T20:15:00Z,"A Moment of Kindness","A stranger showed me a small act of kindness today and it completely changed my mood.","personal",happy,cloudy
30,2024-06-16T12:00:00Z,"Sunday Brunch","Lazy Sunday brunch with my partner. These slow weekends are the best.","personal,food",happy,sunny
31,2024-06-15T16:45:00Z,"Creative Block","Feeling a major creative block. I can't seem to write or come up with any new ideas.","reflection",tired,cloudy
32,2024-06-14T21:00:00Z,"Concert Night","Went to an amazing concert tonight. The energy of the crowd was electric.","social,friends",excited,cloudy
33,2024-06-13T09:00:00Z,"An argument","Had an argument with a close friend. Feeling hurt and misunderstood.","friends,personal",sad,stormy
34,2024-06-12T14:00:00Z,"A walk in the park","Took a long walk in the park during my lunch break. It helped clear my head.","health,relax",neutral,sunny
35,2024-06-11T19:00:00Z,"Trying to learn guitar","Started learning to play the guitar. My fingers hurt but it's fun to learn something new.","goals,personal",happy,cloudy
36,2024-06-10T23:30:00Z,"Can't sleep","Can't seem to fall asleep. Too many thoughts running through my head.","personal",tired,cloudy
37,2024-06-09T11:20:00Z,"Volunteering","Spent the morning volunteering at the local animal shelter. It was so rewarding.","personal",happy,sunny
38,2024-06-08T15:00:00Z,"A lazy Saturday","Absolutely nothing productive happened today, and it was glorious. Sometimes you just need a day to do nothing.","relax",neutral,cloudy
39,2024-06-07T17:00:00Z,"Good news!","Received some really good news today! I'm so thrilled and can't stop smiling.","personal",excited,sunny
40,2024-06-06T20:00:00Z,"Reflecting on the past","Thinking a lot about the past lately. It's a mix of happy and sad memories.","reflection",neutral,rainy
41,2024-06-05T10:00:00Z,"A difficult conversation","Had a difficult conversation I've been putting off. It was hard, but necessary.","personal,challenge",tired,cloudy
42,2024-06-04T12:30:00Z,"A delicious meal","Cooked a delicious meal for myself. It's a form of self-care.","food,personal",happy,sunny
43,2024-06-03T18:00:00Z,"Feeling anxious","Feeling really anxious today for no apparent reason. It's frustrating.","personal",sad,cloudy
44,2024-06-02T08:45:00Z,"Morning yoga","Started the day with some yoga. It really helps center me.","health,relax",neutral,sunny
45,2024-06-01T22:00:00Z,"A new month","A new month begins. Full of possibilities. I'm setting some intentions for the weeks ahead.","goals,reflection",excited,cloudy
46,2024-05-31T16:00:00Z,"End of the month rush","Work was crazy trying to get everything done by the end of the month. Glad it's over.","work",tired,rainy
47,2024-05-30T19:30:00Z,"A long-awaited reunion","Met up with a friend I haven't seen in years. It was like no time had passed.","friends,social",happy,cloudy
48,2024-05-29T13:00:00Z,"A simple observation","I saw a bird building a nest today. It was a simple, beautiful moment.","nature,reflection",neutral,sunny
49,2024-05-28T21:00:00Z,"A quiet night in","Sometimes, a quiet night with a cup of tea and a good book is all you need.","relax,reading",neutral,cloudy
50,2024-05-27T10:10:00Z,"Feeling grateful","Woke up this morning feeling incredibly grateful for everything and everyone in my life.","reflection",happy,sunny
51,2024-05-26T12:00:00Z,"A day of doing nothing","I spent the entire day doing nothing productive. It was amazing.","relax",neutral,cloudy
52,2024-05-25T08:00:00Z,"Early morning jog","Woke up early for a jog. It was tough but I feel great now.","health",happy,sunny
53,2024-05-24T22:00:00Z,"An inspiring movie","Watched a really inspiring movie tonight. It made me want to be a better person.","reflection",excited,cloudy
54,2024-05-23T18:00:00Z,"A disagreement","Had a disagreement with a family member. It's weighing on me.","family",sad,rainy
55,2024-05-22T14:00:00Z,"A productive day","I was so productive today. Ticked off everything on my to-do list.","work,goals",excited,sunny
56,2024-05-21T20:00:00Z,"Feeling nostalgic","Listening to old songs and feeling very nostalgic.","reflection",neutral,cloudy
57,2024-05-20T11:00:00Z,"A walk in the rain","Took a walk in the rain today. It was refreshing.","personal",happy,rainy
58,2024-05-19T16:00:00Z,"A frustrating bug","Spent hours trying to fix a bug in my code. It was so frustrating.","work,challenge",tired,stormy
59,2024-05-18T19:00:00Z,"Dinner party","Hosted a small dinner party. It was a lot of work but worth it.","friends,social",happy,cloudy
60,2024-05-17T09:00:00Z,"A new idea","A new idea for a project popped into my head this morning. I'm excited to explore it.","goals",excited,sunny
61,2024-05-16T21:00:00Z,"Feeling lonely","Feeling a bit lonely tonight. It comes in waves.","personal",sad,cloudy
62,2024-05-15T13:00:00Z,"A breakthrough","Had a breakthrough with a difficult task. It feels great to finally figure it out.","work",excited,sunny
63,2024-05-14T17:00:00Z,"A beautiful sunset","Watched a stunning sunset today. Nature's beauty is awe-inspiring.","nature,reflection",happy,sunny
64,2024-05-13T22:00:00Z,"An old memory","An old memory surfaced today. It's funny what the mind holds onto.","reflection",neutral,cloudy
65,2024-05-12T10:00:00Z,"A lazy Sunday","Woke up late and had a lazy Sunday. Just what I needed.","relax",neutral,cloudy
66,2024-05-11T15:00:00Z,"A visit to the museum","Visited a museum today. It was fascinating to see all the art and history.","personal,travel",happy,cloudy
67,2024-05-10T19:00:00Z,"A difficult goodbye","Had to say a difficult goodbye today. It's never easy.","personal",sad,rainy
68,2024-05-09T08:00:00Z,"An energetic start","Woke up feeling full of energy. Ready to take on the day.","personal",excited,sunny
69,2024-05-08T20:00:00Z,"A quiet evening","Just a quiet evening at home. Sometimes it's nice to just be with your own thoughts.","relax",neutral,cloudy
70,2024-05-07T14:00:00Z,"A helping hand","Helped someone today and it felt good. Small acts of kindness matter.","personal",happy,cloudy
71,2024-05-06T18:00:00Z,"A long day","It was a long and tiring day. I'm ready to just relax and unwind.","work",tired,rainy
72,2024-05-05T11:00:00Z,"A day of reading","Spent the whole day reading. It's been a while since I've done that.","reading,relax",neutral,cloudy
73,2024-05-04T16:00:00Z,"A surprise gift","Received a surprise gift today. It was so thoughtful and made my day.","friends",happy,sunny
74,2024-05-03T21:00:00Z,"A moment of clarity","Had a moment of clarity about a problem that's been bothering me. It feels like a weight has been lifted.","reflection",excited,cloudy
75,2024-05-02T09:00:00Z,"A fresh perspective","Talked to someone with a different perspective and it was really enlightening.","personal",neutral,sunny
76,2024-05-01T19:00:00Z,"A new month, a new goal","Setting a new goal for this month. I'm determined to achieve it.","goals",excited,cloudy
77,2024-04-30T15:00:00Z,"A sense of accomplishment","Finished a big project today. The sense of accomplishment is amazing.","work,goals",excited,sunny
78,2024-04-29T20:00:00Z,"A quiet night","Just a quiet night in. Sometimes the best nights are the ones with no plans.","relax",neutral,cloudy
79,2024-04-28T12:00:00Z,"A picnic in the park","Had a lovely picnic in the park. The weather was perfect.","food,friends",happy,sunny
80,2024-04-27T18:00:00Z,"A creative spark","Felt a creative spark today and wrote a short story. It felt good to create something.","personal",excited,cloudy
81,2024-04-26T22:00:00Z,"Feeling lost","Feeling a bit lost and unsure of what to do next. It's a confusing time.","reflection",sad,rainy
82,2024-04-25T10:00:00Z,"A good workout","Had a great workout this morning. Feeling strong and capable.","health",happy,sunny
83,2024-04-24T16:00:00Z,"A difficult client","Dealt with a difficult client today. It was challenging but I handled it professionally.","work,challenge",tired,stormy
84,2024-04-23T19:00:00Z,"A cozy evening","A cozy evening with a warm blanket and a hot cup of tea. Perfect.","relax",neutral,cloudy
85,2024-04-22T13:00:00Z,"A random act of kindness","Witnessed a random act of kindness today. It restored my faith in humanity.","reflection",happy,sunny
86,2024-04-21T21:00:00Z,"An old movie","Watched an old black and white movie. There's something so charming about them.","personal",neutral,cloudy
87,2024-04-20T11:00:00Z,"A day trip","Took a day trip to a nearby town. It was fun to explore somewhere new.","travel",excited,sunny
88,2024-04-19T17:00:00Z,"A tough workout","Pushed myself hard at the gym today. I'm sore but it feels good.","health",tired,cloudy
89,2024-04-18T20:00:00Z,"A heartfelt conversation","Had a deep and heartfelt conversation with my partner. It brought us closer.","personal",happy,cloudy
90,2024-04-17T09:00:00Z,"A new perspective","I tried looking at a problem from a new perspective and it made all the difference.","reflection",excited,sunny
91,204-04-16T14:00:00Z,"A frustrating meeting","Sat through a long and frustrating meeting. It felt like a waste of time.","work",tired,rainy
92,2024-04-15T18:00:00Z,"A home-cooked meal","Made a delicious home-cooked meal. It's so much better than takeout.","food",happy,cloudy
93,2024-04-14T22:00:00Z,"A quiet mind","My mind is surprisingly quiet tonight. It's a peaceful feeling.","relax",neutral,cloudy
94,2024-04-13T10:00:00Z,"A sunny day","It's a beautiful sunny day. I'm going to spend as much time as possible outdoors.","personal",happy,sunny
95,2024-04-12T16:00:00Z,"A setback","Had a setback on a project. It's discouraging but I'm not giving up.","work,challenge",sad,stormy
96,2024-04-11T19:00:00Z,"A night of music","Spent the evening listening to my favorite albums. Music always lifts my spirits.","personal",happy,cloudy
97,2024-04-10T08:00:00Z,"An early start","Woke up before sunrise. The world is so quiet and peaceful at that hour.","reflection",neutral,sunny
98,2024-04-09T13:00:00Z,"A productive collaboration","Had a great collaboration with a colleague. We accomplished so much together.","work",excited,cloudy
99,2024-04-08T20:00:00Z,"A wave of sadness","A wave of sadness washed over me tonight. I'm not sure why.","personal",sad,rainy
100,2024-04-07T11:00:00Z,"A new discovery","Discovered a new author today and I'm already hooked on their books.","reading",excited,sunny
101,2024-04-06T15:00:00Z,"A day of cleaning","Spent the day deep cleaning my apartment. It feels so fresh and organized now.","personal",neutral,cloudy
102,2024-04-05T18:00:00Z,"A fun evening","Had a really fun evening with friends. We played board games and laughed a lot.","friends,social",happy,cloudy
103,2024-04-04T09:00:00Z,"A challenging puzzle","Worked on a challenging puzzle today. It was a great mental workout.","personal",neutral,sunny
104,2024-04-03T21:00:00Z,"A quiet contemplation","Spent some time in quiet contemplation. It helped me process my thoughts and feelings.","reflection",neutral,cloudy
105,2024-04-02T12:00:00Z,"A delicious lunch","Had a delicious lunch at a new cafe. The food was amazing.","food",happy,sunny
106,2024-04-01T17:00:00Z,"A new beginning","It's the first day of the month. I'm feeling optimistic about what's to come.","goals",excited,cloudy
107,2024-03-31T20:00:00Z,"A night of reflection","Reflecting on the past month. It's been a mix of ups and downs.","reflection",neutral,cloudy
108,2024-03-30T10:00:00Z,"A day in nature","Spent the day hiking in nature. It was so refreshing to be away from the city.","nature,travel",happy,sunny
109,2024-03-29T16:00:00Z,"A creative slump","I'm in a creative slump. I can't seem to come up with any good ideas.","reflection",tired,rainy
110,2024-03-28T19:00:00Z,"A reunion","Had a reunion with my old college friends. It was so good to see them all.","friends,social",happy,cloudy
111,2024-03-27T08:00:00Z,"A motivated morning","Woke up feeling so motivated. I'm going to crush my goals today.","goals",excited,sunny
112,2024-03-26T22:00:00Z,"A late night work session","Had to pull a late night to finish a project. I'm exhausted.","work",tired,cloudy
113,2024-03-25T14:00:00Z,"A simple pleasure","Enjoyed a simple pleasure today: a warm cup of coffee and a good book.","reading,relax",neutral,cloudy
114,2024-03-24T18:00:00Z,"A difficult conversation","Had a difficult conversation with my boss. It was stressful but productive.","work,challenge",tired,stormy
115,2024-03-23T11:00:00Z,"A day of adventure","Went on a spontaneous adventure today. It was so much fun.","travel,personal",excited,sunny
116,2024-03-22T20:00:00Z,"A quiet dinner","Had a quiet dinner at home. Sometimes it's nice to just be alone.","relax",neutral,cloudy
117,2024-03-21T09:00:00Z,"A burst of energy","Felt a sudden burst of energy and cleaned my entire apartment.","personal",excited,sunny
118,2024-03-20T15:00:00Z,"A day of learning","Spent the day learning a new skill. It was challenging but rewarding.","goals",neutral,cloudy
119,2024-03-19T19:00:00Z,"A sad movie","Watched a really sad movie. It made me cry.","personal",sad,rainy
120,2024-03-18T12:00:00Z,"A delicious brunch","Had a delicious brunch with friends. The food was incredible.","food,friends",happy,sunny
121,2024-03-17T17:00:00Z,"A feeling of peace","Feeling a sense of peace and calm today. It's a nice change.","reflection",neutral,cloudy
122,2024-03-16T21:00:00Z,"A late night drive","Went for a late night drive. The city looks so different at night.","personal",neutral,cloudy
123,2024-03-15T10:00:00Z,"A productive morning","Had a very productive morning. I feel like I can accomplish anything today.","work,goals",excited,sunny
124,2024-03-14T16:00:00Z,"A moment of doubt","Had a moment of self-doubt today. It's hard to stay confident all the time.","reflection",sad,cloudy
125,2024-03-13T19:00:00Z,"A fun game night","Had a fun game night with my family. It's always a good time.","family",happy,cloudy
126,2024-03-12T08:00:00Z,"An early morning reflection","Woke up early and spent some time reflecting. It was a good way to start the day.","reflection",neutral,sunny
127,2024-03-11T22:00:00Z,"A tired mind","My mind is so tired. I can't seem to think straight.","personal",tired,cloudy
128,2024-03-10T14:00:00Z,"A day of exploring","Spent the day exploring a new neighborhood. There's so much to see in my own city.","travel,personal",excited,sunny
129,2024-03-09T18:00:00Z,"A difficult workout","Did a really difficult workout today. I'm exhausted but proud of myself.","health",tired,cloudy
130,2024-03-08T20:00:00Z,"A heartfelt gift","Received a really heartfelt gift from a friend. It meant so much to me.","friends",happy,cloudy
131,2024-03-07T09:00:00Z,"A clear mind","My mind feels so clear today. I'm ready to tackle anything that comes my way.","personal",excited,sunny
132,2024-03-06T15:00:00Z,"A frustrating task","Worked on a frustrating task for hours. I'm so glad it's finally done.","work,challenge",tired,rainy
133,2024-03-05T19:00:00Z,"A delicious dinner","Cooked a delicious dinner tonight. I'm getting better at cooking.","food",happy,cloudy
134,2024-03-04T22:00:00Z,"A peaceful evening","Just a peaceful evening at home. It's nice to have some quiet time.","relax",neutral,cloudy
135,2024-03-03T10:00:00Z,"A beautiful day","It's such a beautiful day. I'm going to spend the whole day outside.","personal",happy,sunny
136,2024-03-02T16:00:00Z,"A major accomplishment","Achieved a major goal today. I'm so proud of myself.","goals",excited,sunny
137,2024-03-01T19:00:00Z,"A new month, new energy","Feeling a renewed sense of energy with the start of a new month.","goals",excited,cloudy
138,2024-02-29T14:00:00Z,"A leap of faith","Took a leap of faith today. I'm scared but also excited.","personal,challenge",excited,cloudy
139,2024-02-28T20:00:00Z,"A quiet reflection","Spent the evening reflecting on the month. It's been a good one.","reflection",neutral,cloudy
140,2024-02-27T11:00:00Z,"A day of gardening","Spent the day gardening. It's so therapeutic to work with my hands in the dirt.","personal,relax",happy,sunny
141,2024-02-26T17:00:00Z,"A difficult client meeting","Had a difficult client meeting today. It's tough to please everyone.","work,challenge",tired,stormy
142,2024-02-25T21:00:00Z,"A night of stargazing","The stars are so bright tonight. It's a beautiful sight.","nature,reflection",neutral,sunny
143,2024-02-24T10:00:00Z,"A lazy Saturday morning","Woke up late and had a lazy Saturday morning. It was perfect.","relax",neutral,cloudy
144,2024-02-23T16:00:00Z,"A creative breakthrough","Had a creative breakthrough today. The ideas are flowing.","work,goals",excited,cloudy
145,2024-02-22T19:00:00Z,"A sad song","Listened to a sad song that really resonated with me. It's okay to feel sad sometimes.","personal",sad,rainy
146,2024-02-21T08:00:00Z,"A morning of mindfulness","Started the day with a mindfulness meditation. It helped me feel more present.","health,relax",neutral,sunny
147,2024-02-20T22:00:00Z,"A late-night snack","Had a late-night snack and watched some TV. A simple pleasure.","food,relax",neutral,cloudy
148,2024-02-19T13:00:00Z,"A productive lunch break","Used my lunch break to run some errands. It feels good to be productive.","personal",neutral,cloudy
149,2024-02-18T18:00:00Z,"A family dinner","Had a lovely dinner with my family. It's always good to connect.","family",happy,cloudy
150,2024-02-17T11:00:00Z,"A day of rest","Took a much-needed day of rest. I feel so much better.","relax",neutral,cloudy
151,2024-02-16T15:00:00Z,"A challenging task","Completed a challenging task at work. I'm proud of my persistence.","work,challenge",excited,sunny
152,2024-02-15T20:00:00Z,"A night of reading","Curled up with a good book tonight. It's my favorite way to unwind.","reading,relax",neutral,cloudy
153,2024-02-14T19:00:00Z,"A romantic dinner","Had a romantic dinner with my partner. It was a special evening.","personal",happy,cloudy
154,2024-02-13T09:00:00Z,"A fresh snowfall","Woke up to a beautiful fresh snowfall. It's so quiet and peaceful.","nature",happy,snowy
155,2024-02-12T14:00:00Z,"A frustrating delay","My flight was delayed for hours. It was so frustrating.","travel",tired,stormy
156,2024-02-11T18:00:00Z,"A cozy day in","It's snowing outside, so I'm having a cozy day in. Hot chocolate and a movie.","relax",neutral,snowy
157,2024-02-10T11:00:00Z,"A winter walk","Went for a walk in the snow. It was cold but beautiful.","nature",happy,snowy
158,2024-02-09T21:00:00Z,"A quiet night by the fire","Spent the evening by the fire. It was so warm and cozy.","relax",neutral,cloudy
159,2024-02-08T10:00:00Z,"A day of planning","Spent the day planning my goals for the next quarter. I'm excited for what's to come.","goals,work",excited,cloudy
160,2024-02-07T16:00:00Z,"A difficult decision","Had to make a difficult decision at work. I hope it's the right one.","work,challenge",neutral,cloudy
161,2024-02-06T19:00:00Z,"A fun night out","Went out with friends for a fun night of bowling. It was a blast.","friends,social",happy,cloudy
162,2024-02-05T08:00:00Z,"A productive start","Had a very productive start to the week. I'm feeling on top of things.","work,goals",excited,sunny
163,2024-02-04T22:00:00Z,"A late-night study session","Stayed up late studying for an exam. I'm exhausted but I think I'm prepared.","goals",tired,cloudy
164,2024-02-03T13:00:00Z,"A delicious homemade pizza","Made homemade pizza for lunch. It was so much better than delivery.","food",happy,cloudy
165,2024-02-02T18:00:00Z,"A frustrating commute","My commute home was a nightmare. So much traffic.","personal",tired,rainy
166,2024-02-01T20:00:00Z,"A new month, a fresh start","It's the beginning of a new month. I'm feeling hopeful and optimistic.","goals",excited,cloudy
167,2024-01-31T15:00:00Z,"A sense of relief","Finished a major deadline today. I feel such a sense of relief.","work",happy,sunny
168,2024-01-30T19:00:00Z,"A quiet evening of reflection","Spent the evening reflecting on the past month. It's been a whirlwind.","reflection",neutral,cloudy
169,2024-01-29T11:00:00Z,"A day of organization","Spent the day organizing my digital files. It's a tedious task but it feels good to have it done.","personal",neutral,cloudy
170,2024-01-28T16:00:00Z,"A creative afternoon","Spent the afternoon painting. It was so relaxing and I'm happy with how it turned out.","personal",happy,cloudy
171,2024-01-27T21:00:00Z,"A night of good conversation","Had a long and meaningful conversation with a friend. It's good to connect on a deeper level.","friends",happy,cloudy
172,2024-01-26T09:00:00Z,"A challenging workout","Pushed myself to a new limit in my workout today. I'm sore but it feels good.","health",tired,cloudy
173,2024-01-25T14:00:00Z,"A frustrating meeting","Had a frustrating meeting where nothing got accomplished. I feel like I wasted my time.","work",tired,rainy
174,2024-01-24T18:00:00Z,"A delicious experiment","Tried a new recipe for dinner and it was a delicious success.","food",happy,cloudy
175,2024-01-23T22:00:00Z,"A peaceful night","It's a quiet and peaceful night. I'm grateful for these moments of calm.","relax",neutral,cloudy
